Rice Paper Spring Rolls,Rice paper rolled with veggies<br>Options: to add seafood choices,img/appetizer/springrolls_seafoodchoices.jpg,Appetizers,Appetizers,wheat-egg-paenut-seasame
Spring Rolls,Crispy rolls filled with a colorful mix of veggies<br>Options: to add seafood choices,img/appetizer/Deep-fry Spring Rolls.jpg.,Appetizers,Appetizers,wheat-egg-paenut-seasame
Gyoza Dumpling,Protein choices with dipping sauce,img/appetizer/Gyoza(Dumpling).jpg,Appetizers,Appetizers,wheat-beans-seasame
Seaweed Salad,Sesame crusted fresh seaweed salad,img/appetizer/seaweedsalads.jpg,Appetizers,Appetizers,soy-seasame
Calamari Salad,Sesame crusted flavourful calamari salad,img/appetizer/calamarisalads.jpg,Appetizers,Appetizers,wheat-soy-peanut-shellfish
Avocado Wrap,Avocado-crisp veggies-savory seasoning,img/appetizer/avocado_warp.jpg,Appetizers,Appetizers,wheat-soy-egg-milk
Inari,Deep-fried tofu pouch stuffed with sushi rice<br>Options: Shrimp-Crab-Avocado,img/appetizer/inari.jpg,Appetizers,Appetizers,wheat-soy
Edamame,Steamed soybeans lightly salted,img/appetizer/edamame(soybean).jpg,Appetizers,Appetizers,beans
NIGIRI Sushi,fresh raw fish on seasoned rice with wasabi-wrapped in nori<br>Options: Salmon-Crab-Yellowtail-Tuna-Snapper-Shrimp-Eel*,img/Nigiri/Nigiri.jpg,Nigiri,Sushi,wheat-soy-shellfish-seasame
Assorted Nigiri,A selection of fresh fish <br>Options: Salmon-Crab-Yellowtail-Tuna-Snapper-Shrimp-Eel*,img/Nigiri/assortednigiri.jpg,Nigiri,Sushi,wheat-soy-shellfish-seasame
Spicy Roll & Nigiri Sushi,Assorted nigiri sushi on spicy tuna roll base*,img/rolls(Maki Sushi)/Spicy Roll & Nigiri Sushi.JPG,Rolls(MakiSushi),Sushi,wheat-soy-shellfish-seasame-spicy
Cali Roll & Nigiri,Assorted nigiri sushi & california*,img/Nigiri/caliroll&nigiri.jpg,Nigiri,Sushi,wheat-soy-shellfish-seasame
California Rolls,Imitation crab meat-avocado-cucumber,img/rolls(Maki Sushi)/California Roll 1.JPG,Rolls(MakiSushi),Sushi,wheat-soy-shellfish-seasame
Cripsy California Roll,,img/rolls(Maki Sushi)/Crispy California Roll 1.jpg,Rolls(MakiSushi),Sushi,
Phili Deluxe ROll,Cream cheese-avocado-cucumber with choice of imitation Crab-Salmon or Smoke Salmon,img/rolls(Maki Sushi)/Philly Deluxe Roll (Smoked Salmon).jpg,Rolls(MakiSushi),Sushi,wheat-soy-egg-milk-seasame
Crispy Rolls,Options: Crab or Shrimp with avocado-cucumber,img/rolls(Maki Sushi)/Crispy Roll 1.jpg,Rolls(MakiSushi),Sushi,wheat-soy-egg-shellfish
Spicy Rolls,Options:Tuna-Shrimp-Salmon-Snapper with cucumber-avocado-mild spicy sauce*,img/rolls(Maki Sushi)/Spicy Roll 1.jpg,Rolls(MakiSushi),Sushi,wheat-soy-egg-shellfish-spicy
BBQ Eel Rolls,flavored eel & cool cucumber topped with eel sauce,img/rolls(Maki Sushi)/BBQEelRoll.jpg,Rolls(MakiSushi),Sushi,wheat-soy-shellfish-seasame
Hosomaki Rolls,Bite sized rolls in traditional style with your choice of ingredients*,img/rolls(Maki Sushi)/hosomaki.jpg,Rolls(MakiSushi),Sushi,wheat-soy-shellfish
Shrimp Tempura Rolls,Crispy shrimp tempura-avocado-cucumber-mild spicy sauce,img/rolls(Maki Sushi)/Shrimp Tempura Roll.JPG,Rolls(MakiSushi),Sushi,wheat-soy-egg-shellfish-spicy 
Mini Sea Pack Rolls,Assorted bitesized fish rolls*,img/rolls(Maki Sushi)/MiniSeaPackRoll.jpg,Rolls(MakiSushi),Sushi,wheat-soy-shellfish
Rainbow Rolls,Variety of fishes over california roll*,img/rolls(Maki Sushi)/rainbow_roll.jpg,Rolls(MakiSushi),Sushi,wheat-soy-shellfish
Veggie Rolls,Cucumber-carrots-avocado-lettuce,img/rolls(Maki Sushi)/VeggieRoll.jpg,Rolls(MakiSushi),Sushi,wheat-soy-beans-seasame
Salmon Avocado Rolls,Salmon-avocado <br>Options: with or without cream cheese*,img/rolls(Maki Sushi)/Salmon Avo Roll 2.JPG,Rolls(MakiSushi),Sushi,wheat-soy-egg-milk-shellfish-seasame
Tuna Avocado Rolls,Tuna-avocado <br>Options: with or without cream cheese*,img/rolls(Maki Sushi)/TunaAvoRoll.jpg,Rolls(MakiSushi),Sushi,wheat-soy-shellfish-seasame
Spicy Crab Salad Rolls,Fresh crab salad-avocado-cucumber with spicy sauce,img/rolls(Maki Sushi)/SpicyCrabSalad_Roll.jpg,Rolls(MakiSushi),Sushi,wheat-soy-shellfish-seasame-spicy
Temaki Sushi,Nori cone filled with fresh fish- rice & veggie<br>Options: Veggie-Salmon-Crab-Shrimp-Tuna-Eal*,img/handrolls(Seaweed)/Temakisushi.jpg,Hand-Rolls(Seaweed),Sushi,wheat-soy-shellfish-seasame
Sashimi,Assorted fresh slices of raw fish with a hint of wasabi- wrapped in nori<br>Options: Salmon-Crab-YellowTail-Shrimp-Tuna- Snapper-Eal*,img/handrolls(Seaweed)/sashimi.jpg,Hand-Rolls(Seaweed),Sushi,wheat-soy-shellfish-seasame
AssortedVeggie PokeBowl,Fresh vibrant veggies and savory sauces atop rice-delivering a burst of flavor in each bite,img/bowls/AssortedVeggie_PokeBowl.jpg,Bowls,Bowls,beans-soy
Golden Salmon PokeBowl,Tender salmon served over rice with assorted fresh veggies and flavourful savory sauces,img/bowls/GoldenSalmon_PokeBowl.jpg,Bowls,Bowls,beans-soy-shellfish-seasame
Grilled Steak PokeBowl,Grilled steak over rice with assorted veggies and flavourful savory sauce,img/bowls/TarriyakiGrilledSteakBowl.jpg,Bowls,Bowls,beans-soy-seasame
Tuna(Ahi) _PokeBowl,Fresh tuna served over rice with assorted fresh veggies and savory sauces,img/bowls/Tuna (Ahi)_PokeBowl.jpg,Bowls,Bowls,wheat-soy-egg-shellfish-seasame
Shrimp(Ebi)_PokeBowl,Grilled chicken served over rice with assorted fresh veggies and flavourful savory sauces,img/bowls/Shrimp(Ebi)_PokeBowl.jpg,Bowls,Bowls,wheat-soy-egg-shellfish-seasame
Grilled Chicken Bowl,Grilled chicken glazed with teriyaki sauce served over rice with assorted fresh veggies,img/bowls/Grilled Chicken Bowl.jpg,Bowls,Bowls,wheat-soy-egg-shellfish-seasame
Grilled Steak Bowl,Grilled beef steak glazed with teriyaki sauce served over rice with assorted fresh veggies,img/bowls/Grilled Steak Bowl.JPG,Bowls,Bowls,
TariyakiChicken_Bowl,Homemade tariyaki chicken in japanese sweet and savory curry sauce over rice,img/bowls/TariyakiChicken_Bowl.jpg,Bowls,Bowls,wheat-soy-egg-seasame
Japanese Curry Chicken_Bowl,Tender slices of beef simmered in sweet and savory sauces served over rice,img/bowls/JapaneseCurryChicken_Bowl.jpg,Bowls,Bowls,wheat-soy-egg-seasame
Gyudon Beef_Bowl,Delightful selection of chef's favorites rolls-nigiri-maki sushi rolls (come complete with soy sauce and wasabi for the perfect sushi  experience),img/bowls/GyudonBeef_Bowl.jpg,Bowls,Bowls,wheat-soy-egg-seasame
Veggie Pho,Fresh veggies and fragrant broth in a floavorful rice noodle soup,img/Noodles/Vegetable_Pho.jpg,Noodles,Noodles,wheat-soy-beans-seasame
Beef Pho,Tender beef slices in savory broth with rice noodles and fresh herbs,img/Noodles/Beef_Pho.jpg,Noodles,Noodles,wheat-soy-beans-egg-milk-seasame
Grilled Chicken Miso_Ramen,Grilled chicken served in a rich miso broth with ramen noodles and assorted veggies,img/Noodles/GrilledChickenMiso_Ramen.jpg,Noodles,Noodles,wheat-soy-beans-egg-milk-seasame
Tonkotsu (OR) Miso ChashuPork_Ramen,Creamy and savory tonkotsu broth served with tender chashu pork and ramen noodles,img/Noodles/Tonkotsu(OR)MisoChashuPork_Ramen.jpg,Noodles,Noodles,wheat-soy-beans-egg-milk-seasame
Veggie_Ramen,A flavorful veggie broth with assorted fresh veggies and ramen noodles,img/Noodles/Veggie_Ramen.jpg,Noodles,Noodles,wheat-soy-beans-seasame
Chef Special 1,Delightful selection of favorites: rainbow rolls-nigiri assortment-spicy tuna rolls-inari (come complete with soy sauce and wasabi for the perfect sushi experience)*,img/specialities/Chef Special Sushi 1.JPG,Specialities,Specialities,soy-beans-shellfish-seasame
Chef Special 2,Delightful selection of favorites: rainbow rolls-nigiri assortment-spicy tuna rolls-inari (come complete with soy sauce and wasabi for the perfect sushi experience)*,img/specialities/Chef Special Sushi 2.JPG,Specialities,Specialities,soy-beans-shellfish-seasame
Platter,Choose between traditional nigiri sushi or combination of sushi rolls and nigiri<br>Options: assorted fully cooked & raw fish*,img/specialities/Sushi_Platter.jpg,Specialities,Specialities,soy-beans-shellfish-seasame
MLH Combo,Choose between traditional nigiri sushi or combination of sushi rolls and nigiri <br>Options: assorted fully cooked & raw fish*,img/specialities/Combo.jpg,Specialities,Specialities,soy-beans-shellfish-seasame